{
  "$comment": "Escalation path. Production builder whose profile standard is Carrier asks for Trane. Expect: ESCALATE_TO_RYAN, HOLD subject prefix, full draft still produced.",
  "received_at": "2026-08-06T10:20:00",
  "builder_name": "Example Production Homes",
  "from_email": "super@exampleproduction.com",
  "project": "Plan 1840 - Lot 12 Cypress Point",
  "project_type": "new construction",
  "customer_type": "builder",
  "jurisdiction": "",
  "stories": 1,
  "conditioned_sqft": 1950,
  "email_subject": "Plan 1840 - switching brands on this section",
  "email_body": "For this section we want to move to Trane equipment. Price it that way.",
  "attachments": ["Plan1840_Architectural.pdf"],
  "plans": {"architectural": true, "mechanical": false, "plot": false},
  "mechanical_plan_system_count": null,
  "ai_plan_review": {"system_count": null, "notes": ""},
  "manual_j": {},
  "explicit": {
    "system_count": null,
    "equipment": "Trane XR15 heat pump",
    "gross_margin": null,
    "deadline": ""
  },
  "notes": ""
}
